Symbol,Name,Last Sale,Net Change,% Change,Market Cap,Country,IPO Year,Volume,Sector,Industry
PEB^E,Pebblebrook Hotel Trust 6.375% Series E Cumulative Redeemable Preferred Shares of Beneficial Interest,$21.257,0.0087,0.041%,,United States,,603,,
PEB^F,Pebblebrook Hotel Trust 6.3% Series F Cumulative Redeemable Preferred Shares of Beneficial Interest,$21.31,0.13,0.614%,,United States,,2069,,
PEB^G,Pebblebrook Hotel Trust 6.375% Series G Cumulative Redeemable Preferred Shares of Beneficial Interest,$20.80,-0.20,-0.952%,,United States,,8612,,
PEB^H,Pebblebrook Hotel Trust 5.700% Series H Cumulative Redeemable Preferred Shares of Beneficial Interest,$19.00,-0.08,-0.419%,,United States,,6906,,
PEG,Public Service Enterprise Group Incorporated Common Stock,$57.67,0.20,0.348%,28737785796.00,United States,,1678034,Utilities,Power Generation
PEN,Penumbra Inc. Common Stock,$252.37,1.78,0.71%,9740564887.00,United States,2015,250879,Health Care,Medical/Dental Instruments
PEO,Adams Natural Resources Fund Inc. Common Stock,$20.55,0.07,0.342%,0.00,United States,,34485,Finance,Finance/Investors Services
PERF,Perfect Corp. Class A Ordinary Share,$2.41,-0.07,-2.823%,244566800.00,Taiwan,2022,6681,Technology,Computer Software: Prepackaged Software
PFD,Flaherty & Crumrine Preferred and Income Fund Incorporated,$10.45,0.11,1.064%,0.00,United States,1991,43697,Finance,Investment Managers
PFE,Pfizer Inc. Common Stock,$27.47,0.00,0.00%,155106973131.00,United States,,47044073,Health Care,Biotechnology: Pharmaceutical Preparations
PFGC,Performance Food Group Company Common Stock,$70.80,-0.30,-0.422%,11016546764.00,United States,2015,519613,Consumer Discretionary,Food Distributors
PFH,Prudential Financial Inc. 4.125% Junior Subordinated Notes due 2060,$20.46,0.0598,0.293%,56330796127.00,United States,2020,18350,Finance,Life Insurance
PFL,PIMCO Income Strategy Fund Shares of Beneficial Interest,$8.49,0.01,0.118%,0.00,United States,2003,109874,Finance,Finance Companies
PFLT,PennantPark Floating Rate Capital Ltd. Common Stock,$11.50,-0.16,-1.372%,675449073.00,United States,2022,1717143,Finance,Finance: Consumer Services
PFN,PIMCO Income Strategy Fund II,$7.52,0.02,0.267%,0.00,United States,2004,234064,Finance,Finance/Investors Services
PFO,Flaherty & Crumrine Preferred and Income Opportunity Fund Incorporated,$8.41,0.00,0.00%,0.00,United States,1992,13704,Finance,Finance Companies
PFS,Provident Financial Services Inc Common Stock,$17.76,0.09,0.509%,1342772026.00,United States,2003,682924,Finance,Savings Institutions
PFSI,PennyMac Financial Services Inc. Common Stock,$87.63,0.00,0.00%,4374993648.00,United States,2013,141173,Finance,Finance: Consumer Services
PG,Procter & Gamble Company (The) Common Stock,$156.14,0.52,0.334%,367400707372.00,United States,,8356602,Consumer Discretionary,Package Goods/Cosmetics
PGP,Pimco Global StocksPlus & Income Fund Common Shares of Beneficial Interest,$7.56,0.0298,0.396%,0.00,United States,2005,6694,Finance,Finance Companies
PGR,Progressive Corporation (The) Common Stock,$179.42,1.41,0.792%,104968039534.00,United States,,2354319,Finance,Property-Casualty Insurers
PGRE,Paramount Group Inc. Common Stock,$5.04,0.00,0.00%,1095461675.00,United States,2014,1740154,Real Estate,Real Estate Investment Trusts
PGRU,PropertyGuru Group Limited Ordinary Shares,$3.33,-0.03,-0.893%,541391400.00,,2022,3473,Technology,EDP Services
PGSS,Pegasus Digital Mobility Acquisition Corp. Class A Ordinary Shares,$11.14,0.02,0.18%,0.00,,2021,1099,Finance,Blank Checks
PGTI,PGT Innovations Inc.,$41.30,0.10,0.243%,2356160664.00,United States,2006,1504222,Industrials,Building Products
PGZ,Principal Real Estate Income Fund Common Shares of Beneficial Interest,$9.66,0.01,0.104%,0.00,,2013,22270,Finance,Investment Managers
PH,Parker-Hannifin Corporation Common Stock,$471.59,-0.21,-0.045%,60587913840.00,United States,,444766,Industrials,Metal Fabrications
PHD,Pioneer Floating Rate Fund Inc.,$9.39,-0.02,-0.213%,0.00,United States,2004,62716,Finance,Investment Managers
PHG,Koninklijke Philips N.V. NY Registry Shares,$22.76,-0.19,-0.828%,20062496795.00,Netherlands,,1256160,Health Care,Medical Electronics
PHI,PLDT Inc. Sponsored ADR,$22.69,0.06,0.265%,4902305535.00,Philippines,,28555,Telecommunications,Telecommunications Equipment
PHIN,PHINIA Inc. Common Stock,$29.64,-0.08,-0.269%,1383752796.00,United States,2023,315465,,
PHK,Pimco High Income Fund,$4.88,-0.01,-0.204%,0.00,United States,2003,286790,Finance,Finance/Investors Services
PHM,PulteGroup Inc. Common Stock,$105.12,-0.01,-0.01%,22663344298.00,United States,,1891491,Consumer Discretionary,Homebuilding
PHR,Phreesia Inc. Common Stock,$25.25,0.20,0.798%,1404782286.00,United States,2019,497296,Consumer Discretionary,Business Services
PHT,Pioneer High Income Fund Inc.,$7.33,0.01,0.137%,0.00,United States,,188035,Finance,Investment Managers
PHX,PHX Minerals Inc. Common Stock,$3.25,-0.02,-0.612%,120251105.00,United States,2003,274679,Energy,Oil & Gas Production
PHYT,Pyrophyte Acquisition Corp. Class A Ordinary Shares,$11.09,0.005,0.045%,0.00,,2021,27201,Finance,Blank Checks
PII,Polaris Inc. Common Stock,$91.37,-0.41,-0.447%,5159910873.00,United States,,671888,Consumer Discretionary,Industrial Specialties
PIM,Putnam Master Intermediate Income Trust Common Stock,$3.21,0.00,0.00%,161313395.00,United States,1988,16787,Finance,Finance Companies
PINE,Alpine Income Property Trust Inc. Common Stock,$15.97,-0.02,-0.125%,218788377.00,United States,2019,25159,Real Estate,Real Estate Investment Trusts
PINS,Pinterest Inc. Class A Common Stock,$37.70,0.71,1.919%,25423316619.00,United States,2019,14789204,Technology,Computer Software: Programming Data Processing
PIPR,Piper Sandler Companies Common Stock,$176.26,-1.25,-0.704%,3121488456.00,United States,,46528,Finance,Investment Bankers/Brokers/Service
PJT,PJT Partners Inc. Class A Common Stock,$96.84,0.04,0.041%,2347457283.00,United States,2015,162642,Finance,Investment Managers
PK,Park Hotels & Resorts Inc. Common Stock ,$15.55,0.02,0.129%,3265246908.00,United States,2016,2135993,Consumer Discretionary,Hotels/Resorts
PKE,Park Aerospace Corp. Common Stock,$15.69,0.05,0.32%,317775234.00,United States,,111017,Industrials,Military/Government/Technical
PKG,Packaging Corporation of America Common Stock,$171.96,0.28,0.163%,15411794112.00,United States,2000,700909,Consumer Discretionary,Containers/Packaging
PKST,Peakstone Realty Trust Common Shares,$15.86,-0.23,-1.429%,571168956.00,United States,2023,118847,Real Estate,Real Estate Investment Trusts
PKX,POSCO Holdings Inc. American Depositary Shares (Each representing 1/4th of a share of Common Stock),$77.28,2.43,3.246%,23446497594.00,South Korea,1994,160140,Industrials,Steel/Iron Ore
PL,Planet Labs PBC Class A Common Stock,$2.29,-0.01,-0.435%,658663430.00,United States,2021,680695,Industrials,Aerospace
PLD,Prologis Inc. Common Stock,$126.87,0.67,0.531%,117224200770.00,United States,,2333027,Real Estate,Real Estate Investment Trusts
PLNT,Planet Fitness Inc. Common Stock,$68.99,-1.12,-1.597%,6081255459.00,United States,2015,1354421,Consumer Discretionary,Hotels/Resorts
PLOW,Douglas Dynamics Inc. Common Stock,$28.70,0.40,1.413%,659639796.00,United States,2010,178347,Industrials,Construction/Ag Equipment/Trucks
PLTR,Palantir Technologies Inc. Class A Common Stock,$16.35,-0.11,-0.668%,35577426183.00,United States,2020,28543296,Technology,Retail: Computer Software & Peripheral Equipment
PLYM,Plymouth Industrial REIT Inc. Common Stock,$22.61,-0.26,-1.137%,1023106660.00,United States,2017,189365,Real Estate,Real Estate Investment Trusts
PM,Philip Morris International Inc Common Stock,$90.85,-0.36,-0.395%,141036084282.00,United States,,5935776,Health Care, Medicinal Chemicals and Botanical Products 
PMF,PIMCO Municipal Income Fund Common Stock,$9.38,0.05,0.536%,0.00,United States,2001,95703,Finance,Finance/Investors Services
PML,Pimco Municipal Income Fund II Common Shares of Beneficial Interest,$8.182,-0.018,-0.22%,0.00,United States,2002,166657,Finance,Investment Managers
PMM,Putnam Managed Municipal Income Trust Common Stock,$6.05,0.01,0.166%,294869794.00,United States,1989,59885,Finance,Investment Managers
PMO,Putnam Municipal Opportunities Trust Common Stock,$10.29,-0.02,-0.194%,349670324.00,United States,1993,70671,Finance,Finance Companies
PMT,PennyMac Mortgage Investment Trust Common Shares of Beneficial Interest,$14.96,0.00,0.00%,1295895698.00,United States,2009,361456,Real Estate,Real Estate Investment Trusts
PMT^A,PennyMac Mortgage Investment Trust 8.125% Series A Fixed-to-Floating Rate Cumulative Redeemable Preferred Shares of Beneficial Interest,$23.99,-0.01,-0.042%,,United States,,15318,,
PMT^B,PennyMac Mortgage Investment Trust 8.00% Series B Fixed-to-Floating Rate Cumulative Redeemable Preferred Shares of Beneficial Interest,$24.24,0.06,0.248%,,United States,,19247,,
PMT^C,PennyMac Mortgage Investment Trust 6.75% Series C Cumulative Redeemable Preferred Shares of Beneficial Interest,$19.5953,0.1453,0.747%,,United States,,27803,,
PMTU,PennyMac Mortgage Investment Trust 8.50% Senior Notes due 2028,$25.30,0.01,0.04%,0.00,United States,2023,3219,,
PMX,PIMCO Municipal Income Fund III Common Shares of Beneficial Interest,$7.17,-0.02,-0.278%,0.00,United States,2002,82220,Finance,Trusts Except Educational Religious and Charitable
PNC,PNC Financial Services Group Inc. (The) Common Stock,$151.60,0.35,0.231%,60388512276.00,United States,,998345,Finance,Major Banks
PNF,PIMCO New York Municipal Income Fund Common Stock,$7.74,0.03,0.389%,0.00,United States,2001,23739,Finance,Finance Companies
PNI,Pimco New York Municipal Income Fund II Common Shares of Beneficial Interest,$7.36,-0.04,-0.541%,0.00,United States,2002,18389,Finance,Trusts Except Educational Religious and Charitable
PNM,PNM Resources Inc. (Holding Co.) Common Stock,$37.03,0.07,0.189%,3178465384.00,United States,,1291860,Utilities,Electric Utilities: Central
PNNT,PennantPark Investment Corporation Common Stock,$7.21,0.04,0.558%,470268645.00,United States,2022,348480,Finance,Finance: Consumer Services
PNR,Pentair plc. Ordinary Share,$72.44,0.28,0.388%,11974256590.00,Switzerland,,2783405,Industrials,Fluid Controls
PNST,Pinstripes Holdings Inc. Class A Common Stock,$3.8991,0.3091,8.61%,43840260.00,,2022,38137,Finance,Blank Checks
PNW,Pinnacle West Capital Corporation Common Stock,$71.37,1.38,1.972%,8093239954.00,United States,,2242214,Utilities,Electric Utilities: Central
POR,Portland General Electric Co Common Stock,$40.58,-0.13,-0.319%,4103607984.00,United States,,384993,Utilities,Electric Utilities: Central
PORT,Southport Acquisition Corporation Class A Common Stock,$10.65,0.00,0.00%,0.00,,2022,321,Finance,Blank Checks
POST,Post Holdings Inc. Common Stock,$92.79,0.24,0.259%,5600280508.00,United States,2012,875881,Consumer Staples,Packaged Foods
PPG,PPG Industries Inc. Common Stock,$143.04,0.25,0.175%,33728832000.00,United States,,1633309,Consumer Discretionary,Paints/Coatings
PPL,PPL Corporation Common Stock,$25.89,0.06,0.232%,19084150431.00,United States,,2671509,Utilities,Electric Utilities: Central
PPT,Putnam Premier Income Trust Common Stock,$3.61,-0.01,-0.276%,359297029.00,United States,1988,165048,Finance,Finance Companies
PR,Permian Resources Corporation Class A Common Stock,$13.63,-0.05,-0.365%,10546441797.00,United States,2022,4996319,Energy,Oil & Gas Production
PRA,ProAssurance Corporation Common Stock,$13.60,-0.33,-2.369%,693183065.00,United States,,218550,Finance,Property-Casualty Insurers
PRE^J,PartnerRe Ltd. 4.875% Fixed Rate Non-Cumulative Redeemable Preferred Shares Series J,$19.77,0.34,1.75%,,Bermuda,,30904,,
PRG,PROG Holdings Inc. Common Stock,$31.85,0.65,2.083%,1424404045.00,United States,,422959,Consumer Discretionary,Diversified Commercial Services
PRGO,Perrigo Company plc Ordinary Shares,$33.44,0.32,0.966%,4531336992.00,United States,,874535,Health Care,Biotechnology: Pharmaceutical Preparations
PRH,Prudential Financial Inc. 5.950% Junior Subordinated Notes due 2062,$26.05,-0.05,-0.192%,9404050000.00,United States,2022,64345,Finance,Life Insurance
PRI,Primerica Inc. Common Stock,$226.04,0.38,0.168%,7919078579.00,United States,2010,81199,Finance,Life Insurance
PRIF^D,Priority Income Fund Inc. 7.00% Series D Term Preferred Stock due 2029,$22.70,0.00,0.00%,,,,500,,
PRIF^F,Priority Income Fund Inc. 6.625% Series F Term Preferred Stock due 2027,$23.0997,0.0797,0.346%,,,,6182,,
PRIF^G,Priority Income Fund Inc. 6.25% Series G Preferred Stock Due 2026,$23.6114,0.00,0.00%,,,,47,,
PRIF^H,Priority Income Fund Inc. 6.00% Series H Term Preferred Stock due 2026,$22.96,0.14,0.613%,,,,259,,
PRIF^I,Priority Income Fund Inc. 6.125% Series I Term Preferred Stock due 2028,$22.07,-0.06,-0.271%,,,,5205,,
PRIF^J,Priority Income Fund Inc. 6.000% Series J Term Preferred Stock due 2028,$22.33,0.17,0.767%,,,,2219,,
PRIF^K,Priority Income Fund Inc. 7.000% Series K Cumulative Preferred Stock,$20.40,0.03,0.147%,,,,3976,,
PRIF^L,Priority Income Fund Inc. 6.375% Series L Term Preferred Stock Due 2029,$22.6351,0.2051,0.914%,,,,325,,
PRIM,Primoris Services Corporation Common Stock,$32.53,-0.36,-1.095%,1735814170.00,United States,,287523,Industrials,Water Sewer Pipeline Comm & Power Line Construction
PRLB,Proto Labs Inc. Common stock,$37.30,-0.12,-0.321%,961814182.00,United States,2012,77210,Industrials,Metal Fabrications
PRM,Perimeter Solutions SA Ordinary Shares,$4.53,0.06,1.342%,692112870.00,Luxembourg,2021,484777,Consumer Discretionary,Newspapers/Magazines
PRMW,Primo Water Corporation Common Stock,$14.81,0.01,0.068%,2360837575.00,Canada,,690142,Consumer Staples,Beverages (Production/Distribution)
PRO,PROS Holdings Inc. Common Stock,$35.84,0.20,0.561%,1658009580.00,United States,2007,244151,Technology,EDP Services
PRS,Prudential Financial Inc. 5.625% Junior Subordinated Notes due 2058,$25.18,-0.002,-0.008%,9089980000.00,United States,2018,13719,Finance,Life Insurance
PRT,PermRock Royalty Trust Trust Units,$4.72,0.02,0.426%,57422255.00,United States,2018,50373,Energy,Oil & Gas Production
PRU,Prudential Financial Inc. Common Stock,$106.22,0.45,0.425%,38345420000.00,United States,2001,1171621,Finance,Life Insurance
PSA,Public Storage Common Stock,$289.88,-1.80,-0.617%,50971386641.00,United States,,562333,Real Estate,Real Estate Investment Trusts
PSA^F,Public Storage Depositary Shares Each Representing 1/1000 of a 5.15% Cumulative Preferred Share of Beneficial Interest Series F par value $0.01 per share,$24.42,0.00,0.00%,,United States,,17309,,
PSA^G,Public Storage Depositary Shares Each Representing 1/1000 of a 5.05% Cumulative Preferred Share of Beneficial Interest Series G,$24.35,-0.02,-0.082%,,United States,,10969,,
PSA^H,Public Storage Depositary Shares Each Representing 1/1000 of a  5.60% Cumulative Preferred  Share of Beneficial Interest Series H,$25.4627,0.0727,0.286%,,United States,,9386,,
PSA^I,Public Storage Depositary Shares Each Representing 1/1000 of a 4.875% Cumulative Preferred Share of Beneficial Interest Series I par value $0.01 per share,$23.2901,0.1401,0.605%,,United States,,14161,,
PSA^J,Public Storage Depositary Shares Each Representing 1/1000 of a 4.700% Cumulative Preferred Share of Beneficial Interest Series J par value $0.01 per share,$22.05,0.05,0.227%,,United States,,7413,,
PSA^K,Public Storage Depositary Shares Each Representing 1/1000 of a 4.75% Cumulative Preferred Share of Beneficial Interest Series K,$22.30,0.11,0.496%,,United States,,3116,,
PSA^L,Public Storage Depositary Shares Each Representing 1/1000 of a 4.625% Cumulative Preferred Share of Beneficial Interest Series L par value $0.01 per share,$22.0201,0.1603,0.733%,,United States,,14992,,
PSA^M,Public Storage Depositary Shares Each Representing 1/1000 of a 4.125% Cumulative Preferred Share of Beneficial Interest Series M,$19.59,0.14,0.72%,,United States,,7382,,
PSA^N,Public Storage Depositary Shares Each Representing 1/1000 of a 3.875% Cumulative Preferred Share of Beneficial Interest Series N,$17.91,0.12,0.675%,,United States,,9835,,
PSA^O,Public Storage Depositary Shares Each Representing 1/1000 of a 3.900% Cumulative Preferred Share of Beneficial Interest Series O,$18.05,0.1055,0.588%,,United States,,7398,,
PSA^P,Public Storage Depositary Shares Each Representing 1/1000 of a 4.000% Cumulative Preferred Share of Bene cial Interest Series P,$18.85,0.01,0.053%,,United States,,25051,,
PSA^Q,Public Storage Depositary Shares Each Representing 1/1000 of a 3.950% Cumulative Preferred Share of Beneficial Interest Series Q par value $0.01 per share,$18.1503,-0.0397,-0.218%,,United States,,7137,,
PSA^R,Public Storage Depositary Shares Each Representing 1/1000 of a 4.00% Cumulative Preferred Share of Bene cial Interest Series R,$18.99,0.144,0.764%,,United States,,20371,,
PSA^S,Public Storage Depositary Shares Each Representing 1/1000 of a 4.100% Cumulative Preferred Share of Beneficial Interest Series S,$19.43,0.09,0.465%,,United States,,11022,,
PSBD,Palmer Square Capital BDC Inc. Common Stock,$16.24,-0.08,-0.49%,0.00,,2024,592277,,
PSEC^A,Prospect Capital Corporation 5.35% Series A Fixed Rate Cumulative Perpetual Preferred Stock,$18.945,-0.045,-0.237%,,United States,,15121,,
PSF,Cohen & Steers Select Preferred and Income Fund Inc. Common Stock,$19.57,-0.02,-0.102%,961642950.00,,2010,17901,Finance,Investment Managers
PSFE,Paysafe Limited Common Shares,$15.73,0.69,4.588%,969795917.00,,2021,972318,Consumer Discretionary,Business Services
PSN,Parsons Corporation Common Stock,$66.36,1.00,1.53%,6960429859.00,United States,2019,906726,Technology,EDP Services
PSO,Pearson Plc Common Stock,$12.25,0.06,0.492%,8746500000.00,United Kingdom,,535607,Consumer Discretionary,Books
PSQH,PSQ Holdings Inc. Class A Common Stock,$5.39,-0.07,-1.282%,148811179.00,,2021,188802,Consumer Discretionary,Advertising
PSTG,Pure Storage Inc. Class A Common Stock,$40.67,-0.61,-1.478%,12850614589.00,United States,2015,2595860,Technology,Electronic Components
PSTL,Postal Realty Trust Inc. Class A Common Stock,$14.42,-0.07,-0.483%,313122946.00,United States,2019,43552,Real Estate,Real Estate Investment Trusts
PSX,Phillips 66 Common Stock,$140.22,2.57,1.867%,61690570727.00,United States,,3388652,Energy,Integrated oil Companies
PTA,Cohen & Steers Tax-Advantaged Preferred Securities and Income Fund Common Shares of Beneficial Interest,$18.42,-0.10,-0.54%,1018137078.00,United States,2020,236334,Finance,Trusts Except Educational Religious and Charitable
PTY,Pimco Corporate & Income Opportunity Fund,$13.79,0.06,0.437%,0.00,United States,2002,436890,Finance,Investment Managers
PUK,Prudential Public Limited Company Common Stock,$21.87,0.30,1.391%,30106415232.00,United Kingdom,,1460338,Finance,Life Insurance
PUMP,ProPetro Holding Corp. Common Stock,$8.40,0.13,1.572%,925996705.00,United States,2017,1221586,Energy,Oilfield Services/Equipment
PVH,PVH Corp. Common Stock,$123.36,3.98,3.334%,7356882864.00,United States,,1008180,Consumer Discretionary,Apparel
PVL,Permianville Royalty Trust Trust Units ,$1.70,0.08,4.938%,56100000.00,United States,2011,131203,Energy,Oil & Gas Production
PWR,Quanta Services Inc. Common Stock,$196.30,-1.69,-0.854%,28519423907.00,United States,,870497,Industrials,Engineering & Construction
PWSC,PowerSchool Holdings Inc. Class A Common Stock,$23.82,0.22,0.932%,4810224115.00,United States,2021,392998,Technology,Computer Software: Prepackaged Software
PX,P10 Inc. Class A Common Stock,$9.23,0.14,1.54%,1079510913.00,United States,2021,337738,Finance,Investment Managers
PXD,Pioneer Natural Resources Company Common Stock,$230.44,2.17,0.951%,53763699229.00,United States,,2344031,Energy,Oil & Gas Production
PYN,PIMCO New York Municipal Income Fund III Common Shares of Beneficial Interest,$5.8542,-0.0257,-0.437%,0.00,United States,2002,2439,Finance,Investment Managers
PZC,PIMCO California Municipal Income Fund III Common Shares of Beneficial Interest,$7.20,0.03,0.418%,0.00,United States,2002,67327,Finance,Investment Managers
QBTS,D-Wave Quantum Inc. Common Shares,$0.82,0.102,14.206%,92989321.00,,2022,1231519,Technology,Retail: Computer Software & Peripheral Equipment
QD,Qudian Inc. American Depositary Shares each representing one Class A Ordinary Share,$2.03,-0.01,-0.49%,471460042.00,China,2017,307175,Finance,Finance: Consumer Services
QGEN,Qiagen N.V. Common Shares ,$44.10,0.02,0.045%,10042452000.00,Netherlands,,929891,Health Care,Biotechnology: Biological Products (No Diagnostic Substances)
QS,QuantumScape Corporation Class A Common Stock,$6.63,-0.02,-0.301%,3245791326.00,United States,2020,4009502,Consumer Discretionary,Auto Parts:O.E.M.
QSR,Restaurant Brands International Inc. Common Shares,$76.88,0.04,0.052%,24008350022.00,Canada,2014,964599,Consumer Discretionary,Restaurants
QTWO,Q2 Holdings Inc. Common Stock,$42.87,-0.48,-1.107%,2513682664.00,United States,2014,332460,Technology,EDP Services
QUAD,Quad Graphics Inc Class A Common Stock,$5.72,0.03,0.527%,293483859.00,United States,,109077,Consumer Discretionary,Publishing
QVCC,QVC Inc. 6.250% Senior Secured Notes due 2068,$12.40,-0.02,-0.161%,12.00,United States,2019,20071,Consumer Discretionary,Catalog/Specialty Distribution
QVCD,QVC Inc. 6.375% Senior Secured Notes due 2067,$12.14,-0.12,-0.979%,0.00,United States,2018,16536,Consumer Discretionary,Catalog/Specialty Distribution
R,Ryder System Inc. Common Stock,$116.15,1.23,1.07%,5148028524.00,United States,,120142,Consumer Discretionary,Rental/Leasing Companies
RA,Brookfield Real Assets Income Fund Inc. Common Stock,$13.07,0.12,0.927%,0.00,United States,2016,233981,Finance,Investment Managers
RACE,Ferrari N.V. Common Shares,$340.17,4.83,1.44%,83442820300.00,Italy,2015,504256,Consumer Discretionary,Auto Manufacturing
RAMP,LiveRamp Holdings Inc. Common Stock,$40.41,0.15,0.373%,2647294297.00,United States,2018,307704,Technology,EDP Services
RBA,RB Global Inc. Common Stock,$62.26,0.17,0.274%,11352038447.00,Canada,,566692,Consumer Discretionary,Business Services
RBC,RBC Bearings Incorporated Common Stock,$271.85,-0.25,-0.092%,7906756978.00,United States,2022,107059,Industrials,Metal Fabrications
RBCP,RBC Bearings Incorporated 5.00% Series A Mandatory Convertible Preferred Stock,$124.44,-0.47,-0.376%,3619337276.00,United States,2022,782,Industrials,Metal Fabrications
RBLX,Roblox Corporation Class A Common Stock,$40.41,-0.91,-2.202%,25205212089.00,United States,2021,4350612,Technology,EDP Services
RBOT,Vicarious Surgical Inc. Class A Common Stock,$0.4098,0.0059,1.461%,71669697.00,Hong Kong,2020,221804,Health Care,Medical Specialities
RBT,Rubicon Technologies Inc. Class A Common Stock,$1.31,0.13,11.017%,45036195.00,,2022,195642,Technology,Computer Software: Prepackaged Software
RC,Ready Capital Corproation Common Stock,$9.85,0.11,1.129%,1695427990.00,United States,2013,749268,Real Estate,Real Estate Investment Trusts
RC^C,Ready Capital Corporation 6.25% Series C Cumulative Convertible Preferred Stock,$18.5897,0.1097,0.594%,,United States,,1390,,
RC^E,Ready Capital Corporation 6.50% Series E Cumulative Redeemable Preferred Stock,$19.19,0.05,0.261%,,United States,,39027,,
RCB,Ready Capital Corporation 6.20% Senior Notes due 2026,$24.035,-0.055,-0.228%,4137016419.00,United States,2019,13425,Real Estate,Real Estate Investment Trusts
RCC,Ready Capital Corporation 5.75% Senior Notes due 2026,$24.15,0.00,0.00%,4156810756.00,United States,2021,1726,Real Estate,Real Estate Investment Trusts
RCFA,RCF Acquisition Corp. Class A Ordinary Shares,$11.07,0.10,0.912%,0.00,,2021,200,Finance,Blank Checks
RCI,Rogers Communication Inc. Common Stock,$47.44,0.19,0.402%,25075171040.00,Canada,,278889,Telecommunications,Cable & Other Pay Television Services
RCL,Royal Caribbean Cruises Ltd. Common Stock,$123.46,-4.25,-3.328%,31634785940.00,United States,1993,2856681,Consumer Discretionary,Marine Transportation
RCS,PIMCO Strategic Income Fund Inc.,$6.15,-0.01,-0.162%,0.00,United States,1994,60348,Finance,Investment Managers
RCUS,Arcus Biosciences Inc. Common Stock,$15.13,-0.13,-0.852%,1132564698.00,United States,2018,289685,Health Care,Biotechnology: Pharmaceutical Preparations
RDN,Radian Group Inc. Common Stock,$29.26,0.16,0.55%,4481471490.00,United States,,658881,Finance,Property-Casualty Insurers
RDW,Redwire Corporation Common Stock,$2.86,-0.05,-1.718%,185327545.00,United States,2021,100021,Industrials,Military/Government/Technical
RDY,Dr. Reddy's Laboratories Ltd Common Stock,$69.54,0.07,0.101%,11580348497.00,India,,156170,Health Care,Biotechnology: Pharmaceutical Preparations
RELX,RELX PLC PLC American Depositary Shares (Each representing One Ordinary Share),$41.74,0.24,0.578%,78845201211.00,United Kingdom,2015,624277,Consumer Discretionary,Business Services
RERE,ATRenew Inc. American Depositary Shares (every three of which representing two Class A ordinary shares),$1.23,0.05,4.237%,275303751.00,Cayman Islands,2021,212817,Consumer Discretionary,Other Specialty Stores
RES,RPC Inc. Common Stock,$7.41,0.09,1.23%,1602252237.00,United States,,3076340,Energy,Oilfield Services/Equipment
REVG,REV Group Inc. Common Stock,$18.03,0.07,0.39%,1077082667.00,United States,2017,194869,Consumer Discretionary,Auto Manufacturing
REX,REX American Resources Corporation,$41.88,0.31,0.746%,733056841.00,United States,,88572,Industrials,Major Chemicals
REXR,Rexford Industrial Realty Inc. Common Stock,$54.15,0.34,0.632%,11430919824.00,United States,2013,1192671,Real Estate,Real Estate Investment Trusts
REXR^B,Rexford Industrial Realty Inc. 5.875% Series B Cumulative Redeemable Preferred Stock,$23.29,0.14,0.605%,,United States,,1147,,
REXR^C,Rexford Industrial Realty Inc. 5.625% Series C Cumulative Redeemable Preferred Stock par value $0.01 per share,$21.99,0.07,0.319%,,United States,,2711,,
REZI,Resideo Technologies Inc. Common Stock ,$17.08,0.06,0.353%,2495182903.00,United States,2018,480159,Industrials,Wholesale Distributors
