Symbol,Name,Last Sale,Net Change,% Change,Market Cap,Country,IPO Year,Volume,Sector,Industry
DCF,BNY Mellon Alcentra Global Credit Income 2024 Target Term Fund Inc. Common Stock,$8.37,-0.01,-0.119%,0.00,,2017,13476,Finance,Finance/Investors Services
DCI,Donaldson Company Inc. Common Stock,$64.27,-0.40,-0.619%,7721122917.00,United States,,363099,Industrials,Pollution Control Equipment
DCO,Ducommun Incorporated Common Stock,$50.64,-0.40,-0.784%,739160633.00,United States,,56348,Industrials,Military/Government/Technical
DD,DuPont de Nemours Inc. Common Stock,$64.67,0.56,0.873%,27810847958.00,United States,2017,4595364,Industrials,Major Chemicals
DDD,3D Systems Corporation Common Stock,$5.06,-0.02,-0.394%,675176288.00,United States,,718605,Technology,Computer Software: Prepackaged Software
DDL,Dingdong (Cayman) Limited American Depositary Shares (each two representing three Ordinary Shares),$1.30,-0.05,-3.704%,306830191.00,Cayman Islands,2021,182222,Consumer Discretionary,Catalog/Specialty Distribution
DDS,Dillard's Inc. Common Stock,$403.29,4.66,1.169%,6542099401.00,United States,,56754,Consumer Discretionary,Department/Specialty Retail Stores
DDT,Dillard's Capital Trust I,$25.74,-0.04,-0.155%,417549750.00,United States,,4402,Consumer Discretionary,Department/Specialty Retail Stores
DE,Deere & Company Common Stock,$393.62,0.61,0.155%,110209608300.00,United States,,884583,Industrials,Industrial Machinery/Components
DEA,Easterly Government Properties Inc. Common Stock,$12.72,-0.10,-0.78%,1210955804.00,United States,2015,778029,Real Estate,Real Estate Investment Trusts
DEC,Diversified Energy Company plc Ordinary Shares,$12.47,-0.03,-0.24%,600790072.00,,,68797,,
DECK,Deckers Outdoor Corporation Common Stock,$767.79,6.78,0.891%,19755907748.00,United States,1993,197251,Consumer Discretionary,Shoe Manufacturing
DEI,Douglas Emmett Inc. Common Stock,$14.63,0.12,0.827%,2439372990.00,United States,2006,1208324,Real Estate,Real Estate Investment Trusts
DELL,Dell Technologies Inc. Class C Common Stock ,$84.22,1.18,1.421%,59931045568.00,United States,2018,2927097,Technology,Computer Manufacturing
DEO,Diageo plc Common Stock,$144.54,3.63,2.576%,81293913619.00,United Kingdom,,1063555,Consumer Staples,Beverages (Production/Distribution)
DESP,Despegar.com Corp. Ordinary Shares,$9.46,-0.31,-3.173%,624927600.00,Argentina,2017,378012,Consumer Discretionary,Transportation Services
DFH,Dream Finders Homes Inc. Class A Common Stock,$31.99,0.09,0.282%,2978533781.00,United States,2022,145701,Consumer Discretionary,Homebuilding
DFIN,Donnelley Financial Solutions Inc. Common Stock ,$62.91,-0.41,-0.648%,1831161632.00,United States,2016,168901,Consumer Discretionary,Other Consumer Services
DFP,Flaherty & Crumrine Dynamic Preferred and Income Fund Inc. Common Stock,$18.57,-0.02,-0.108%,0.00,,2013,61551,Finance,Investment Managers
DFS,Discover Financial Services Common Stock,$106.92,3.18,3.065%,26736196549.00,United States,,2732350,Finance,Finance: Consumer Services
DG,Dollar General Corporation Common Stock,$133.45,0.57,0.429%,29291908546.00,United States,2009,1384220,Consumer Discretionary,Department/Specialty Retail Stores
DGX,Quest Diagnostics Incorporated Common Stock,$130.44,0.29,0.223%,14666021009.00,United States,,965977,Health Care,Medical Specialities
DHF,BNY Mellon High Yield Strategies Fund Common Stock,$2.35,0.00,0.00%,0.00,United States,1998,322237,Finance,Finance Companies
DHI,D.R. Horton Inc. Common Stock,$140.50,-1.07,-0.756%,46620328121.00,United States,,3806887,Consumer Discretionary,Homebuilding
DHR,Danaher Corporation Common Stock,$233.00,5.61,2.467%,172170015931.00,United States,,6343866,Industrials,Industrial Machinery/Components
DHT,DHT Holdings Inc.,$11.16,0.36,3.333%,1815174000.00,Jersey,2005,1818348,Consumer Discretionary,Marine Transportation
DHX,DHI Group Inc. Common Stock,$2.54,-0.08,-3.053%,118917392.00,United States,2007,142396,Consumer Discretionary,Business Services
DIAX,Nuveen Dow 30SM Dynamic Overwrite Fund Common Shares of Beneficial Interest,$14.39,0.04,0.279%,0.00,,2014,77623,Finance,Finance Companies
DIN,Dine Brands Global Inc. Common Stock,$46.09,0.08,0.174%,711768147.00,United States,,122675,Consumer Discretionary,Restaurants
DINO,HF Sinclair Corporation Common Stock,$55.26,1.54,2.867%,9928351670.00,United States,1960,1161064,Energy,Oil & Gas Production
DIS,Walt Disney Company (The) Common Stock,$95.36,0.50,0.527%,174538926227.00,United States,,7806400,Consumer Discretionary,Movies/Entertainment
DK,Delek US Holdings Inc. Common Stock,$26.59,0.82,3.182%,1699992323.00,United States,2017,728628,Energy,Integrated oil Companies
DKL,Delek Logistics Partners L.P. Common Units representing Limited Partner Interests,$45.47,0.35,0.776%,1982330309.00,United States,2012,92208,Energy,Natural Gas Distribution
DKS,Dick's Sporting Goods Inc Common Stock,$153.03,-0.12,-0.078%,12509323649.00,United States,2002,729593,Consumer Discretionary,Other Specialty Stores
DLB,Dolby Laboratories Common Stock,$84.15,-0.47,-0.555%,9961714868.00,United States,2005,286721,Miscellaneous,Multi-Sector Companies
DLNG,Dynagas LNG Partners LP Common Units,$2.75,0.09,3.383%,101206179.00,Greece,,43091,Consumer Discretionary,Marine Transportation
DLNG^A,Dynagas LNG Partners LP 9.00% Series A Cumulative Redeemable Preferred Units,$25.44,0.03,0.118%,,Greece,,2328,,
DLNG^B,Dynagas LNG Partners LP 8.75% Series B Fixed to Floating Rate Cumulative Redeemable Perpetual Preferred Units liquidation preference $25.00 per Uni,$25.5899,0.0999,0.392%,,Greece,,1658,,
DLR,Digital Realty Trust Inc. Common Stock,$143.20,1.01,0.71%,43368419288.00,United States,2004,1917092,Real Estate,Real Estate Investment Trusts
DLR^J,Digital Realty Trust Inc. 5.250% Series J Cumulative Redeemable Preferred Stock,$22.225,0.075,0.339%,,United States,,10230,,
DLR^K,Digital Realty Trust Inc. 5.850% Series K Cumulative Redeemable Preferred Stock par value $0.01 per share,$24.50,0.14,0.575%,,United States,,8162,,
DLR^L,Digital Realty Trust Inc. 5.200% Series L Cumulative Redeemable Preferred Stock,$22.1784,0.0764,0.346%,,United States,,11971,,
DLX,Deluxe Corporation Common Stock,$20.01,0.00,0.00%,874287825.00,United States,,192204,Consumer Discretionary,Publishing
DLY,DoubleLine Yield Opportunities Fund Common Shares of Beneficial Interest,$14.78,0.04,0.271%,708638614.00,United States,2020,138917,Finance,Investment Managers
DM,Desktop Metal Inc. Class A Common Stock,$0.6344,-0.0036,-0.564%,206012676.00,United States,2019,1434411,Technology,Industrial Machinery/Components
DMA,Destra Multi-Alternative Fund Common Stock,$6.98,0.13,1.898%,0.00,,2022,29848,Finance,Trusts Except Educational Religious and Charitable
DMB,BNY Mellon Municipal Bond Infrastructure Fund Inc. Common Stock,$10.08,-0.03,-0.297%,0.00,,2013,123780,Finance,Trusts Except Educational Religious and Charitable
DMO,Western Asset Mortgage Opportunity Fund Inc. Common Stock,$11.20,0.035,0.313%,0.00,United States,2010,88248,Finance,Trusts Except Educational Religious and Charitable
DNA,Ginkgo Bioworks Holdings Inc. Class A Common Stock,$1.29,0.03,2.381%,2732783157.00,United States,2021,14963694,Health Care,Biotechnology: Biological Products (No Diagnostic Substances)
DNB,Dun & Bradstreet Holdings Inc. Common Stock,$11.97,0.06,0.504%,5254346029.00,United States,2020,1567906,Finance,Finance: Consumer Services
DNMR,Danimer Scientific Inc. Common Stock,$0.6826,-0.005,-0.727%,69649273.00,United States,2020,559417,Industrials,Major Chemicals
DNOW,DNOW Inc. Common Stock,$10.11,-0.08,-0.785%,1075008017.00,United States,2014,589203,Industrials,Metal Fabrications
DNP,DNP Select Income Fund Inc. Common Stock,$8.84,0.11,1.26%,0.00,United States,1987,874891,Finance,Investment Managers
DO,Diamond Offshore Drilling Inc. Common Stock,$12.76,-0.11,-0.855%,1305628746.00,United States,2022,843149,Energy,Oil & Gas Production
DOC,Physicians Realty Trust Common Shares of Beneficial Interest,$12.85,0.01,0.078%,3064563707.00,United States,2013,1297024,Real Estate,Real Estate Investment Trusts
DOCN,DigitalOcean Holdings Inc. Common Stock,$33.00,-0.14,-0.422%,2838294855.00,United States,2021,615406,Technology,Retail: Computer Software & Peripheral Equipment
DOCS,Doximity Inc. Class A Common Stock,$29.04,-0.72,-2.419%,5398761989.00,United States,2021,1562981,Technology,Retail: Computer Software & Peripheral Equipment
DOLE,Dole plc Ordinary Shares,$11.54,0.16,1.406%,1095146000.00,Ireland,2021,344999,Consumer Staples,Farming/Seeds/Milling
DOMA,Doma Holdings Inc. Common Stock,$4.07,-0.03,-0.732%,54687540.00,United States,2021,11896,Finance,Real Estate
DOOR,Masonite International Corporation Ordinary Shares (Canada),$91.50,0.01,0.011%,2004383354.00,Canada,,177643,,
DOUG,Douglas Elliman Inc. Common Stock,$2.31,-0.06,-2.532%,204913909.00,United States,2021,920082,Real Estate,Building operators
DOV,Dover Corporation Common Stock,$149.94,-0.02,-0.013%,20975128191.00,United States,,550503,Industrials,Industrial Machinery/Components
DOW,Dow Inc. Common Stock ,$54.06,-0.88,-1.602%,37917522144.00,United States,2019,5239775,Industrials,Major Chemicals
DPG,Duff & Phelps Utility and Infrastructure Fund Inc.,$8.90,0.06,0.679%,0.00,United States,2011,170113,Finance,Trusts Except Educational Religious and Charitable
DPZ,Domino's Pizza Inc Common Stock,$419.12,1.04,0.249%,14619317595.00,United States,2004,351854,Consumer Discretionary,Food Distributors
DQ,DAQO New Energy Corp. American Depositary Shares each representing five ordinary shares,$19.18,-0.48,-2.442%,1499965475.00,China,2010,610802,Technology,Semiconductors
DRD,DRDGOLD Limited American Depositary Shares,$7.77,0.13,1.702%,671785428.00,South Africa,,273731,Basic Materials,Precious Metals
DRH,Diamondrock Hospitality Company Common Stock,$9.33,0.15,1.634%,1955821748.00,United States,2005,1602158,Real Estate,Real Estate Investment Trusts
DRH^A,Diamondrock Hospitality Company 8.250% Series A Cumulative Redeemable Preferred Stock,$25.50,-0.02,-0.078%,,United States,,3899,,
DRI,Darden Restaurants Inc. Common Stock,$160.99,-1.13,-0.697%,19223946785.00,United States,,556066,Consumer Discretionary,Restaurants
DRQ,Dril-Quip Inc. Common Stock,$22.16,0.37,1.698%,757496454.00,United States,1997,220145,Industrials,Metal Fabrications
DSAQ,Direct Selling Acquisition Corp. Class A Common Stock,$10.93,0.01,0.092%,0.00,,2021,4773,Finance,Blank Checks
DSL,DoubleLine Income Solutions Fund Common Shares of Beneficial Interests,$12.52,-0.04,-0.318%,1277000287.00,United States,2013,278255,Finance,Trusts Except Educational Religious and Charitable
DSM,BNY Mellon Strategic Municipal Bond Fund Inc. Common Stock,$5.595,-0.025,-0.445%,0.00,United States,1989,229629,Finance,Investment Managers
DSU,Blackrock Debt Strategies Fund Inc. Common Stock,$10.88,-0.01,-0.092%,0.00,United States,1998,47260,Finance,Finance Companies
DSX,Diana Shipping inc. common stock,$3.09,0.06,1.98%,481598161.00,Greece,2005,521143,Consumer Discretionary,Marine Transportation
DSX^B,Diana Shipping Inc. Perpetual Preferred Shares Series B (Marshall Islands),$25.53,-0.07,-0.273%,,Greece,,3255,,
DT,Dynatrace Inc. Common Stock,$58.26,0.07,0.12%,17151422521.00,United States,2019,1999034,Technology,Computer Software: Prepackaged Software
DTB,DTE Energy Company 2020 Series G 4.375% Junior Subordinated Debentures due 2080,$20.72,0.13,0.631%,4273680823.00,United States,2020,21457,Utilities,Electric Utilities: Central
DTC,Solo Brands Inc. Class A Common Stock,$2.80,-0.09,-3.114%,254383060.00,United States,2021,849230,Consumer Discretionary,Recreational Games/Products/Toys
DTE,DTE Energy Company Common Stock,$103.59,-0.21,-0.202%,21366341530.00,United States,,1165306,Utilities,Electric Utilities: Central
DTF,DTF Tax-Free Income 2028 Term Fund Inc. Common Stock,$10.78,-0.01,-0.093%,75778732.00,United States,1991,18912,Finance,Investment Managers
DTG,DTE Energy Company 2021 Series E 4.375% Junior Subordinated Debentures,$21.37,-0.07,-0.326%,4407748996.00,United States,2021,18013,Utilities,Electric Utilities: Central
DTM,DT Midstream Inc. Common Stock ,$54.67,0.12,0.22%,5301405718.00,United States,2021,542028,Utilities,Oil & Gas Production
DTW,DTE Energy Company 2017 Series E 5.25% Junior Subordinated Debentures due 2077,$23.90,-0.09,-0.375%,4929583575.00,United States,2017,155196,Utilities,Electric Utilities: Central
DUK,Duke Energy Corporation (Holding Company) Common Stock,$95.87,0.14,0.146%,73888133363.00,United States,,3554121,Utilities,Power Generation
DUK^A,Duke Energy Corporation Depositary Shares each representing a 1/1000th interest in a share of 5.75% Series A Cumulative Redeemable Perpetual Preferred Stock,$25.05,0.03,0.12%,,United States,,80015,,
DUKB,Duke Energy Corporation 5.625% Junior Subordinated Debentures due 2078,$24.98,0.12,0.483%,19252378965.00,United States,2018,15059,Industrials,Railroads
DV,DoubleVerify Holdings Inc. Common Stock,$40.67,-0.13,-0.319%,6913332735.00,United States,2021,1071063,Technology,Computer Software: Prepackaged Software
DVA,DaVita Inc. Common Stock,$107.17,-0.26,-0.242%,9784621000.00,United States,,803830,Health Care,Misc Health and Biotechnology Services
DVN,Devon Energy Corporation Common Stock,$42.62,0.13,0.306%,27306634000.00,United States,1985,5763340,Energy,Oil & Gas Production
DX,Dynex Capital Inc. Common Stock,$12.69,0.00,0.00%,718827182.00,United States,,1195926,Real Estate,Real Estate Investment Trusts
DX^C,Dynex Capital Inc. 6.900% Series C Fixed-to-Floating Rate Cumulative Redeemable Preferred Stock,$24.00,0.0945,0.395%,,United States,,8497,,
DXC,DXC Technology Company Common Stock ,$23.23,0.04,0.172%,4498339899.00,United States,,3787211,Technology,EDP Services
DY,Dycom Industries Inc. Common Stock,$115.18,1.34,1.177%,3379189656.00,United States,,152518,Industrials,Water Sewer Pipeline Comm & Power Line Construction
E,ENI S.p.A. Common Stock,$32.34,0.39,1.221%,54605410116.00,Italy,,248808,Energy,Oil & Gas Production
EAF,GrafTech International Ltd. Common Stock,$1.53,0.01,0.658%,392916087.00,United States,2018,3619337,Energy,Industrial Machinery/Components
EAI,Entergy Arkansas LLC First Mortgage Bonds 4.875% Series Due September 1 2066,$22.57,-0.13,-0.573%,4772947280.00,United States,2016,35525,Utilities,Electric Utilities: Central
EARN,Ellington Residential Mortgage REIT Common Shares of Beneficial Interest,$6.19,0.03,0.487%,101074573.00,United States,2013,400487,Real Estate,Real Estate Investment Trusts
EAT,Brinker International Inc. Common Stock,$39.41,-0.46,-1.154%,1742044289.00,United States,,1396029,Consumer Discretionary,Restaurants
EB,Eventbrite Inc. Class A Common Stock,$8.28,0.03,0.364%,833160079.00,United States,2018,1022423,Technology,Computer Software: Programming Data Processing
EBF,Ennis Inc. Common Stock,$20.78,0.01,0.048%,537676245.00,United States,,49625,Consumer Discretionary,Office Equipment/Supplies/Services
EBR,Centrais Electricas Brasileiras S A American Depositary Shares (Each representing one Common Share),$8.34,-0.04,-0.477%,19155255263.00,Brazil,2016,597332,Utilities,Electric Utilities: Central
EBS,Emergent Biosolutions Inc. Common Stock,$1.82,-0.04,-2.151%,94429604.00,United States,2006,785855,Health Care,Biotechnology: Pharmaceutical Preparations
EC,Ecopetrol S.A. American Depositary Shares,$12.29,0.30,2.502%,25266208893.00,Colombia,,1629110,Energy,Oil & Gas Production
ECAT,BlackRock ESG Capital Allocation Term Trust Common Shares of Beneficial Interest,$16.71,0.09,0.542%,1806935850.00,,2021,379776,Finance,Trusts Except Educational Religious and Charitable
ECC           ,Eagle Point Credit Company Inc. Common Stock,$10.05,-0.06,-0.593%,609658366.00,United States,2014,425988,Finance,Trusts Except Educational Religious and Charitable
ECC^D,Eagle Point Credit Company Inc. 6.75% Series D Preferred Stock,$20.30,-0.27,-1.313%,,United States,,14434,,
ECCC,Eagle Point Credit Company Inc. 6.50% Series C Term Preferred Stock due 2031,$21.96,0.0399,0.182%,1332149027.00,United States,,1283,Finance,Trusts Except Educational Religious and Charitable
ECCV,Eagle Point Credit Company Inc. 5.375% Notes due 2029,$22.555,0.085,0.378%,1368243229.00,United States,2022,366,Finance,Trusts Except Educational Religious and Charitable
ECCW,Eagle Point Credit Company Inc. 6.75% Notes due 2031,$24.09,0.06,0.25%,1461360203.00,United States,2021,968,Finance,Trusts Except Educational Religious and Charitable
ECCX,Eagle Point Credit Company Inc. 6.6875% Notes due 2028,$24.585,0.00,0.00%,1491388153.00,United States,2022,63,Finance,Trusts Except Educational Religious and Charitable
ECL,Ecolab Inc. Common Stock,$198.49,-0.13,-0.065%,56597402872.00,United States,,688625,Consumer Discretionary,Package Goods/Cosmetics
ECO,Okeanis Eco Tankers Corp. Common Stock,$29.72,1.20,4.208%,0.00,,,68825,,
ECVT,Ecovyst Inc. Common Stock,$9.49,0.20,2.153%,1101949334.00,United States,2017,493018,Industrials,Major Chemicals
ED,Consolidated Edison Inc. Common Stock,$90.02,0.35,0.39%,31076684506.00,United States,,2218871,Utilities,Power Generation
EDD,Morgan Stanley Emerging Markets Domestic Debt Fund Inc. Common Stock,$4.62,-0.01,-0.216%,0.00,United States,2007,280906,Finance,Finance Companies
EDF,Virtus Stone Harbor Emerging Markets Income Fund Common Shares of Beneficial Interest,$4.38,-0.02,-0.455%,0.00,United States,2010,108874,Finance,Investment Managers
EDN,Empresa Distribuidora Y Comercializadora Norte S.A. (Edenor) American Depositary Shares,$20.05,0.20,1.008%,908721238.00,Argentina,2007,114179,Utilities,Electric Utilities: Central
EDR,Endeavor Group Holdings Inc. Class A Common Stock,$25.43,0.18,0.713%,17646775289.00,United States,2021,2410630,Consumer Discretionary,Services-Misc. Amusement & Recreation
EDU,New Oriental Education & Technology Group Inc. Sponsored ADR representing 10 Ordinary Share (Cayman Islands),$79.93,-1.12,-1.382%,13229408450.00,China,2006,948002,Real Estate,Other Consumer Services
EE,Excelerate Energy Inc. Class A Common Stock,$15.54,0.08,0.517%,1682710905.00,United States,2022,152708,Utilities,Oil/Gas Transmission
EEA,The European Equity Fund Inc. Common Stock,$8.50,0.08,0.95%,0.00,United States,,6645,Finance,Trusts Except Educational Religious and Charitable
EEX,Emerald Holding Inc. Common Stock,$6.19,-0.04,-0.642%,389304098.00,United States,2017,34192,Consumer Discretionary,Business Services
EFC,Ellington Financial Inc. Common Stock ,$12.90,0.05,0.389%,880220664.00,United States,2010,1285191,Finance,Real Estate
EFC^A,Ellington Financial Inc. 6.750% Series A Fixed-to-Floating Rate Cumulative Redeemable Preferred Stock,$23.96,0.28,1.182%,,United States,,11754,,
EFC^B,Ellington Financial Inc. 6.250% Series B Fixed-Rate Reset Cumulative Redeemable Preferred Stock,$21.08,0.59,2.879%,,United States,,9831,,
EFC^C,Ellington Financial Inc. 8.625% Series C Fixed-Rate Reset Cumulative Redeemable Preferred Stock,$24.39,-0.01,-0.041%,,United States,,3351,,
EFC^D,Ellington Financial Inc. 7.00% Series D Cumulative Perpetual Redeemable Preferred Stock,$21.07,0.31,1.493%,,United States,,2393,,
EFC^E,Ellington Financial Inc. 8.250% Series E Fixed-to-Floating Rate Cumulative Redeemable Preferred Stock,$24.90,-0.05,-0.20%,,United States,,4213,,
EFR,Eaton Vance Senior Floating-Rate Fund Common Shares of Beneficial Interest,$13.06,-0.02,-0.153%,0.00,United States,2003,59242,Finance,Trusts Except Educational Religious and Charitable
EFT,Eaton Vance Floating Rate Income Trust Common Shares of Beneficial Interest,$13.05,-0.04,-0.306%,379629916.00,United States,2004,31774,Finance,Finance Companies
EFX,Equifax Inc. Common Stock,$246.12,-2.31,-0.93%,30326112909.00,United States,,633118,Finance,Finance: Consumer Services
EFXT,Enerflex Ltd Common Shares,$5.43,0.08,1.495%,672929024.00,Canada,2022,42326,Consumer Staples,Meat/Poultry/Fish
EG,Everest Group Ltd. Common Stock,$379.75,3.19,0.847%,16477513514.00,Bermuda,,254947,Finance,Property-Casualty Insurers
EGF,Blackrock Enhanced Government Fund Inc. Common Stock,$9.6499,-0.06,-0.618%,0.00,United States,2005,519,Finance,Trusts Except Educational Religious and Charitable
EGLE,Eagle Bulk Shipping Inc. Common Stock,$55.95,1.43,2.623%,555700659.00,United States,,113325,Consumer Discretionary,Marine Transportation
EGO,Eldorado Gold Corporation Ordinary Shares,$12.20,-0.22,-1.771%,2474978827.00,Canada,,1231676,,
EGP,EastGroup Properties Inc. Common Stock,$178.97,0.41,0.23%,8291755446.00,United States,,135035,Real Estate,Real Estate Investment Trusts
EGY,VAALCO Energy Inc.  Common Stock,$4.47,0.02,0.449%,470059644.00,United States,,539224,,
EHAB,Enhabit Inc. Common Stock,$10.63,-0.07,-0.654%,532877605.00,United States,2022,372586,Health Care,Hospital/Nursing Management
EHC,Encompass Health Corporation Common Stock,$71.68,0.49,0.688%,7185260257.00,United States,,543003,Health Care,Hospital/Nursing Management
EHI,Western Asset Global High Income Fund Inc Common Stock,$7.13,-0.04,-0.558%,0.00,United States,2003,28924,Finance,Investment Managers
EIC,Eagle Point Income Company Inc. Common Stock,$15.36,-0.15,-0.967%,136828539.00,,2019,71606,Finance,Finance/Investors Services
EICA,Eagle Point Income Company Inc. 5.00% Series A Term Preferred Stock due 2026,$23.27,-0.0915,-0.392%,207291673.00,,2021,1750,Finance,Finance/Investors Services
EICB,Eagle Point Income Company Inc. 7.75% Series B Term Preferred Stock Due 2028,$25.06,-0.03,-0.12%,0.00,,,2175,,
EIG,Employers Holdings Inc Common Stock,$41.41,-0.05,-0.121%,1065093235.00,United States,2007,73247,Finance,Property-Casualty Insurers
EIX,Edison International Common Stock,$67.50,0.46,0.686%,25890888128.00,United States,,2284693,Utilities,Electric Utilities: Central
EL,Estee Lauder Companies Inc. (The) Common Stock,$130.80,2.14,1.663%,46806334364.00,United States,1995,3077450,Consumer Discretionary,Package Goods/Cosmetics
ELAN,Elanco Animal Health Incorporated Common Stock,$15.18,0.34,2.291%,7480675355.00,United States,2018,4089307,Health Care,Biotechnology: Pharmaceutical Preparations
ELC,Entergy Louisiana Inc. Collateral Trust Mortgage Bonds 4.875 % Series due September 1 2066,$22.45,-0.02,-0.089%,4494743685.00,United States,2016,27943,Utilities,Electric Utilities: Central
ELF,e.l.f. Beauty Inc. Common Stock,$157.14,0.59,0.377%,8674005431.00,United States,2016,591411,Consumer Discretionary,Package Goods/Cosmetics
ELME,Elme Communities Common Stock,$14.84,0.19,1.297%,1303435903.00,United States,2000,687196,Real Estate,Real Estate Investment Trusts
ELP,Companhia Paranaense de Energia (COPEL) American Depositary Shares (each representing one Unit consisting one Common Share and four non-voting Class B Preferred Shares),$8.19,0.02,0.245%,2662461097.00,Brazil,2021,580517,Utilities,Electric Utilities: Central
ELPC,Companhia Paranaense de Energia (COPEL) American Depositary Shares (each representing four (4) Common Shares),$7.43,0.06,0.814%,0.00,Brazil,2023,80848,Utilities,Electric Utilities: Central
ELS,Equity Lifestyle Properties Inc. Common Stock,$66.73,0.38,0.573%,12437986606.00,United States,,937852,Real Estate,Real Estate Investment Trusts
ELV,Elevance Health Inc. Common Stock,$483.80,3.49,0.727%,113673229513.00,United States,,1272377,Health Care,Medical Specialities
EMD,Western Asset Emerging Markets Debt Fund Inc Common Stock,$8.98,-0.11,-1.21%,0.00,United States,,391046,Finance,Finance/Investors Services
EME,EMCOR Group Inc. Common Stock,$224.21,3.73,1.692%,10547833892.00,United States,,302550,Industrials,Engineering & Construction
EMF,Templeton Emerging Markets Fund Common Stock,$11.22,0.01,0.089%,0.00,United States,1987,24360,Finance,Finance/Investors Services
EMN,Eastman Chemical Company Common Stock,$84.92,0.30,0.355%,10068455984.00,United States,,918882,Industrials,Major Chemicals
EMO,ClearBridge Energy Midstream Opportunity Fund Inc. Common Stock,$35.81,0.21,0.59%,0.00,United States,2011,82170,Finance,Investment Managers
EMP,Entergy Mississippi LLC First Mortgage Bonds 4.90% Series Due October 1 2066,$23.32,0.03,0.129%,4931552086.00,United States,2016,9454,,
EMR,Emerson Electric Company Common Stock,$95.06,-1.18,-1.226%,54193706000.00,United States,,2344502,Technology,Consumer Electronics/Appliances
ENB,Enbridge Inc Common Stock,$35.91,0.22,0.616%,76344660000.00,Canada,,4114188,Energy,Oil & Gas Production
ENFN,Enfusion Inc. Class A Common Stock,$8.43,-0.12,-1.404%,1074642718.00,United States,2021,193563,Technology,Computer Software: Prepackaged Software
ENIC,Enel Chile S.A. American Depositary Shares (Each representing 50 shares of Common Stock),$2.99,0.03,1.014%,4136160121.00,Chile,2016,900200,Utilities,Electric Utilities: Central
ENJ,Entergy New Orleans LLC First Mortgage Bonds 5.0% Series due December 1 2052,$22.3276,0.1876,0.847%,4721686207.00,United States,,2108,Utilities,Power Generation
ENLC,EnLink Midstream LLC Common Units representing Limited Partner Interests,$12.23,0.06,0.493%,5587292916.00,United States,,1029660,Utilities,Natural Gas Distribution
ENO,Entergy New Orleans LLC First Mortgage Bonds 5.50% Series due April 1 2066,$23.74,0.02,0.084%,5020370777.00,United States,2016,5377,Utilities,Power Generation
ENOV,Enovis Corporation Common Stock,$59.80,0.23,0.386%,3264729751.00,United States,,457585,Health Care,Industrial Specialties
ENR,Energizer Holdings Inc. Common Stock,$32.81,0.20,0.613%,2348583372.00,United States,2015,294190,Miscellaneous,Industrial Machinery/Components
ENS,EnerSys Common Stock,$96.98,-0.07,-0.072%,3917907724.00,United States,2004,170732,Technology,Industrial Machinery/Components
ENV,Envestnet Inc Common Stock,$52.47,0.61,1.176%,2867817897.00,United States,2010,224512,Consumer Discretionary,Business Services
ENVA,Enova International Inc. Common Stock,$58.58,1.13,1.967%,1749712312.00,United States,2014,189161,Finance,Finance: Consumer Services
ENZ,Enzo Biochem Inc. Common Stock ($0.01 Par Value),$1.30,0.02,1.563%,65636702.00,United States,1988,34903,Health Care,Medical Specialities
